CPU: ID 0x806ea, Processor Type 0x0, Family 0x6, Model 0x8e, Stepping 0xa
Northbridge: 8086:5914 (unknown)
Southbridge: 8086:9d4e (Sunrise Point Low Power)
IGD: 8086:5917 (unknown)

============= GPIOS =============

GPIOBASE = 0x0000 (IO)

gpiobase+0x0000: 0xffffffff (GPIO_USE_SEL)
gpiobase+0x0000: 0xf96ba1ff (GPIO_USE_SEL) DEFAULT
gpiobase+0x0000: 0x06945e00 (GPIO_USE_SEL) DIFF
gpiobase+0x0004: 0xffffffff (GP_IO_SEL)
gpiobase+0x0004: 0xf6ff6eff (GP_IO_SEL) DEFAULT
gpiobase+0x0004: 0x09009100 (GP_IO_SEL) DIFF
gpiobase+0x0008: 0xffffffff (RESERVED)
gpiobase+0x000c: 0xffffffff (GP_LVL)
gpiobase+0x000c: 0x02fe0100 (GP_LVL) DEFAULT
gpiobase+0x000c: 0xfd01feff (GP_LVL) DIFF
gpiobase+0x0010: 0xffffffff (RESERVED)
gpiobase+0x0014: 0xffffffff (RESERVED)
gpiobase+0x0018: 0xffffffff (GPO_BLINK)
gpiobase+0x0018: 0x00040000 (GPO_BLINK) DEFAULT
gpiobase+0x0018: 0xfffbffff (GPO_BLINK) DIFF
gpiobase+0x001c: 0xffffffff (GP_SER_BLINK)
gpiobase+0x001c: 0x00000000 (GP_SER_BLINK) DEFAULT
gpiobase+0x001c: 0xffffffff (GP_SER_BLINK) DIFF
gpiobase+0x0020: 0xffffff02 (GP_SB_CMDSTS)
gpiobase+0x0024: 0xffffff02 (GP_SB_DATA)
gpiobase+0x0028: 0xff02     (GPI_NMI_EN)
gpiobase+0x0028: 0x0000     (GPI_NMI_EN) DEFAULT
gpiobase+0x0028: 0xff02     (GPI_NMI_EN) DIFF
gpiobase+0x002a: 0xffff     (GPI_NMI_STS)
gpiobase+0x002c: 0xffffff02 (GPI_INV)
gpiobase+0x002c: 0x00000000 (GPI_INV) DEFAULT
gpiobase+0x002c: 0xffffff02 (GPI_INV) DIFF
gpiobase+0x0030: 0xffffff02 (GPIO_USE_SEL2)
gpiobase+0x0030: 0x020300fe (GPIO_USE_SEL2) DEFAULT
gpiobase+0x0030: 0xfdfcfffc (GPIO_USE_SEL2) DIFF
gpiobase+0x0034: 0xffffff02 (GP_IO_SEL2)
gpiobase+0x0034: 0x1f57fff4 (GP_IO_SEL2) DEFAULT
gpiobase+0x0034: 0xe0a800f6 (GP_IO_SEL2) DIFF
gpiobase+0x0038: 0xffffff02 (GP_LVL2)
gpiobase+0x0038: 0xa4aa0003 (GP_LVL2) DEFAULT
gpiobase+0x0038: 0x5b55ff01 (GP_LVL2) DIFF
gpiobase+0x003c: 0xffffff02 (RESERVED)
gpiobase+0x0040: 0xffffffff (GPIO_USE_SEL3)
gpiobase+0x0040: 0x00000000 (GPIO_USE_SEL3) DEFAULT
gpiobase+0x0040: 0xffffffff (GPIO_USE_SEL3) DIFF
gpiobase+0x0044: 0xffffffff (GP_IO_SEL3)
gpiobase+0x0044: 0x00000f00 (GP_IO_SEL3) DEFAULT
gpiobase+0x0044: 0xfffff0ff (GP_IO_SEL3) DIFF
gpiobase+0x0048: 0xffffffff (GPIO_LVL3)
gpiobase+0x0048: 0x00000000 (GPIO_LVL3) DEFAULT
gpiobase+0x0048: 0xffffffff (GPIO_LVL3) DIFF
gpiobase+0x004c: 0x00aaffff (RESERVED)
gpiobase+0x0050: 0xffffffff (RESERVED)
gpiobase+0x0054: 0xffffffff (RESERVED)
gpiobase+0x0058: 0xffffffff (RESERVED)
gpiobase+0x005c: 0xffffffff (RESERVED)
gpiobase+0x0060: 0xffffffff (GP_RST_SEL1)
gpiobase+0x0060: 0x01000000 (GP_RST_SEL1) DEFAULT
gpiobase+0x0060: 0xfeffffff (GP_RST_SEL1) DIFF
gpiobase+0x0064: 0xffffffff (GP_RST_SEL2)
gpiobase+0x0064: 0x00000000 (GP_RST_SEL2) DEFAULT
gpiobase+0x0064: 0xffffffff (GP_RST_SEL2) DIFF
gpiobase+0x0068: 0xffffffff (GP_RST_SEL3)
gpiobase+0x0068: 0x00000000 (GP_RST_SEL3) DEFAULT
gpiobase+0x0068: 0xffffffff (GP_RST_SEL3) DIFF
gpiobase+0x006c: 0xffffffff (RESERVED)
gpiobase+0x0070: 0x00022600 (RESERVED)
gpiobase+0x0074: 0x0002260a (RESERVED)
gpiobase+0x0078: 0xffffffff (RESERVED)
gpiobase+0x007c: 0xffffffff (RESERVED)



============= RCBA ==============

RCBA = 0x00000000 (MEM)

0x1008: 0x0000ffff
0x100c: 0x00cf9a00
0x1010: 0x0000ffff
0x1014: 0x00af9a00
0x1018: 0x0000ffff
0x101c: 0x00cf9200
0x1024: 0x00808900



========== PMBASE/ABASE =========

PMBASE = 0x0000 (IO)

pmbase+0x0000: 0xffff     (PM1_STS)
pmbase+0x0002: 0xffff     (PM1_EN)
pmbase+0x0004: 0xffffffff (PM1_CNT)
pmbase+0x0008: 0xffffffff (PM1_TMR)
pmbase+0x000c: 0xffffffff (RESERVED)
pmbase+0x0010: 0xffffffff (RESERVED)
pmbase+0x0014: 0xffffffff (RESERVED)
pmbase+0x0018: 0xffffffff (RESERVED)
pmbase+0x001c: 0xffffffff (RESERVED)
pmbase+0x0020: 0xffffff02 (GPE0_STS)
               0xffffff02
pmbase+0x0028: 0xffffff02 (GPE0_EN)
               0xffffff02
pmbase+0x0030: 0xffffff02 (SMI_EN)
pmbase+0x0034: 0xffffff02 (SMI_STS)
pmbase+0x0038: 0xff02     (ALT_GP_SMI_EN)
pmbase+0x003a: 0xffff     (ALT_GP_SMI_STS)
pmbase+0x003c: 0x02       (UPRWC)
pmbase+0x003d: 0xff       (RESERVED)
pmbase+0x003e: 0xffff     (RESERVED)
pmbase+0x0040: 0xfff8     (RESERVED)
pmbase+0x0042: 0x00       (GPE_CNTL)
pmbase+0x0043: 0xff       (RESERVED)
pmbase+0x0044: 0xffff     (DEVACT_STS)
pmbase+0x0046: 0xffff     (RESERVED)
pmbase+0x0048: 0xffffffff (RESERVED)
pmbase+0x004c: 0x00aaffff (RESERVED)
pmbase+0x0050: 0x25       (PM2_CNT)
pmbase+0x0051: 0xff       (RESERVED)
pmbase+0x0052: 0xffff     (RESERVED)
pmbase+0x0054: 0xffffffff (RESERVED)
pmbase+0x0058: 0xffffffff (RESERVED)
pmbase+0x005c: 0xffffffff (RESERVED)
pmbase+0x0060: 0x2cdb     (TCO_RLD)
pmbase+0x0062: 0x09       (TCO_DAT_IN)
pmbase+0x0063: 0xff       (TCO_DAT_OUT)
pmbase+0x0064: 0xffff     (TCO1_STS)
pmbase+0x0066: 0xffff     (TCO2_STS)
pmbase+0x0068: 0xffff     (TCO1_CNT)
pmbase+0x006a: 0xffff     (TCO2_CNT)
pmbase+0x006c: 0xffff     (TCO_MESSAGE)
pmbase+0x006e: 0xff       (TCO_WDCNT)
pmbase+0x006f: 0xff       (RESERVED)
pmbase+0x0070: 0x00       (SW_IRQ_GEN)
pmbase+0x0071: 0x26       (RESERVED)
pmbase+0x0072: 0x0002     (TCO_TMR)
pmbase+0x0074: 0x0002260a (RESERVED)
pmbase+0x0078: 0xffffffff (RESERVED)
pmbase+0x007c: 0xffffffff (RESERVED)



============= MCHBAR ============

MCHBAR = 0xfed10000 (MEM)

0x0000: 0x01b034eb
0x0008: 0xf0000000
0x000c: 0xf0000000
0x0020: 0x03710aa1
0x0030: 0x77777777
0x0040: 0x24b38e0b
0x0044: 0x58c0f019
0x004c: 0x000b4823
0x0050: 0x76777676
0x0054: 0x88888888
0x0058: 0x88888888
0x005c: 0x88888888
0x0064: 0x80000000
0x0068: 0x003dffc0
0x006c: 0x062c6650
0x0070: 0xe2525200
0x0074: 0x5e08651c
0x0078: 0xbe518154
0x0080: 0x04000000
0x0084: 0xe3e00000
0x0088: 0x5b000000
0x008c: 0x00000100
0x0100: 0x01a032fb
0x0108: 0xf8000000
0x010c: 0xf8000000
0x0120: 0x038102a1
0x0130: 0x77777777
0x0140: 0x24b38e0b
0x0144: 0x58c0f019
0x014c: 0x000b4823
0x0150: 0x77777777
0x0154: 0x88888888
0x0158: 0x88888888
0x015c: 0x88888888
0x0164: 0x80000000
0x0168: 0x003dffc0
0x016c: 0x062c6650
0x0170: 0xe2525000
0x0174: 0x000e453a
0x0178: 0x00518154
0x0180: 0x04000000
0x0184: 0x03e00000
0x0188: 0x5b000000
0x018c: 0xf0000080
0x0200: 0x01e036e4
0x0208: 0xf0000000
0x020c: 0xf0000000
0x0220: 0x03511aaa
0x0230: 0x77777777
0x0240: 0x24b38e0b
0x0244: 0x58c0f019
0x024c: 0x000b4823
0x0250: 0x76777777
0x0254: 0x88888888
0x0258: 0x88888888
0x025c: 0x88888888
0x0264: 0x80000000
0x0268: 0x003dffc0
0x026c: 0x062c6650
0x0270: 0xe2525207
0x0274: 0x220e453a
0x0278: 0x46518154
0x0280: 0x04000000
0x0284: 0x03e00000
0x0288: 0x5b000000
0x028c: 0x00000100
0x0300: 0x02103cf5
0x0308: 0xec000000
0x030c: 0xec000000
0x0320: 0x03a112a2
0x0330: 0x77777777
0x0340: 0x24b38e0b
0x0344: 0x58c0f019
0x034c: 0x000b4823
0x0350: 0x77777777
0x0354: 0x88888888
0x0358: 0x88888888
0x035c: 0x88888888
0x0364: 0x80000000
0x0368: 0x003dffc0
0x036c: 0x062c6550
0x0370: 0xe2524e07
0x0374: 0x000e453a
0x0378: 0x00518154
0x0380: 0x04000000
0x0384: 0x03e00000
0x0388: 0x5b000000
0x038c: 0xf0000080
0x0400: 0x01b034ed
0x0408: 0xf4000000
0x040c: 0xf4000000
0x0420: 0x03513abb
0x0430: 0x77777777
0x0440: 0x24b38e0b
0x0444: 0x58c0f019
0x044c: 0x000b4823
0x0450: 0x76777777
0x0454: 0x88888888
0x0458: 0x88888888
0x045c: 0x88888888
0x0464: 0x80000000
0x0468: 0x003dffc0
0x046c: 0x062c6650
0x0470: 0xe2524e01
0x0474: 0x000e453a
0x0478: 0x00518154
0x0480: 0x04000000
0x0484: 0x03e00000
0x0488: 0x5b000000
0x048c: 0xf8010000
0x0500: 0x01c03502
0x0508: 0xf4000000
0x050c: 0xf4000000
0x0520: 0x038136b9
0x0530: 0x77777777
0x0540: 0x24b38e0b
0x0544: 0x58c0f019
0x054c: 0x000b4823
0x0550: 0x77777777
0x0554: 0x88888888
0x0558: 0x88888888
0x055c: 0x88888888
0x0564: 0x80000000
0x0568: 0x003dffc0
0x056c: 0x062c6650
0x0570: 0xe2525201
0x0574: 0x000e453a
0x0578: 0x00518154
0x0580: 0x04000000
0x0584: 0x03e00000
0x0588: 0x5b000000
0x058c: 0xf40000c0
0x0600: 0x01b036ec
0x0608: 0xf4000000
0x060c: 0xf4000000
0x0620: 0x035136b9
0x0630: 0x77777777
0x0640: 0x24b38e0b
0x0644: 0x58c0f019
0x064c: 0x000b4823
0x0650: 0x76777577
0x0654: 0x88888888
0x0658: 0x88888888
0x065c: 0x88888888
0x0664: 0x80000000
0x0668: 0x003dffc0
0x066c: 0x062c7e50
0x0670: 0xe2524c08
0x0674: 0x000e453a
0x0678: 0x00518154
0x0680: 0x04000000
0x0684: 0x03e00000
0x0688: 0x5b000000
0x068c: 0x00000100
0x0700: 0x020038fa
0x0708: 0xf8000000
0x070c: 0xf8000000
0x0720: 0x03a13eb9
0x0730: 0x77777777
0x0740: 0x24b38e0b
0x0744: 0x58c0f019
0x074c: 0x000b4823
0x0750: 0x77777777
0x0754: 0x88888888
0x0758: 0x88888888
0x075c: 0x88888888
0x0764: 0x80000000
0x0768: 0x003dffc0
0x076c: 0x062c6550
0x0770: 0xe2524e08
0x0774: 0x000e453a
0x0778: 0x00518154
0x0780: 0x04000000
0x0784: 0x03e00000
0x0788: 0x5b000000
0x078c: 0x00000100
0x0800: 0x01a032ff
0x0808: 0xec000000
0x080c: 0xec000000
0x0820: 0x035176d9
0x0830: 0x77777777
0x0840: 0x24b38e0b
0x0844: 0x58c0f019
0x084c: 0x000b4823
0x0850: 0x77777677
0x0854: 0x88888888
0x0858: 0x88888888
0x085c: 0x88888888
0x0864: 0x80000000
0x0868: 0x003dffc0
0x086c: 0x062c6e50
0x0870: 0xe2524e03
0x0874: 0x000e453a
0x0878: 0x00518154
0x0880: 0x04000000
0x0884: 0x03e00000
0x0888: 0x5b000000
0x088c: 0x00000100
0x0900: 0x01e0390b
0x0908: 0xf8000000
0x090c: 0xf8000000
0x0920: 0x035176d7
0x0930: 0x77777777
0x0940: 0x24b38e0b
0x0944: 0x58c0f019
0x094c: 0x000b4823
0x0950: 0x77777777
0x0954: 0x88888888
0x0958: 0x88888888
0x095c: 0x88888888
0x0964: 0x80000000
0x0968: 0x003df042
0x096c: 0x064caa50
0x0970: 0xe2527403
0x0974: 0x000e453a
0x0978: 0x00518154
0x0980: 0x04000000
0x0984: 0x03e00000
0x0988: 0x5b000000
0x098c: 0xf4000080
0x0a00: 0x01d034fd
0x0a08: 0xf0000000
0x0a0c: 0xf0000000
0x0a20: 0x035176da
0x0a30: 0x77777777
0x0a40: 0x24b38e0b
0x0a44: 0x58c0f019
0x0a4c: 0x000b4823
0x0a50: 0x77777777
0x0a54: 0x88888888
0x0a58: 0x88888888
0x0a5c: 0x88888888
0x0a64: 0x80000000
0x0a68: 0x003dffc0
0x0a6c: 0x062c6650
0x0a70: 0xe2524e0a
0x0a74: 0x1b0e453a
0x0a78: 0x40518154
0x0a80: 0x04000000
0x0a84: 0x03e00000
0x0a88: 0x5b000000
0x0a8c: 0xfc010000
0x0b00: 0x02003d0b
0x0b08: 0xf8000000
0x0b0c: 0xf8000000
0x0b20: 0x03817ad7
0x0b30: 0x77777777
0x0b40: 0x24b38e0b
0x0b44: 0x58c0f019
0x0b4c: 0x000b4823
0x0b50: 0x77777777
0x0b54: 0x88888888
0x0b58: 0x88888888
0x0b5c: 0x88888888
0x0b64: 0x80000000
0x0b68: 0x003dffc0
0x0b6c: 0x064cb150
0x0b70: 0xee52720a
0x0b74: 0x000e453a
0x0b78: 0x00518154
0x0b80: 0x04000000
0x0b84: 0x03e00000
0x0b88: 0x5b000000
0x0b8c: 0xf4000080
0x0c00: 0x01a0330d
0x0c08: 0xf0000000
0x0c0c: 0xf0000000
0x0c20: 0x03518ae4
0x0c30: 0x77777777
0x0c40: 0x24b38e0b
0x0c44: 0x58c0f019
0x0c4c: 0x000b4823
0x0c50: 0x77777777
0x0c54: 0x88888888
0x0c58: 0x88888888
0x0c5c: 0x88888888
0x0c64: 0x80000000
0x0c68: 0x003dffc0
0x0c6c: 0x064cb650
0x0c70: 0xe6527005
0x0c74: 0x000e453a
0x0c78: 0x00518154
0x0c80: 0x04000000
0x0c84: 0x03e00000
0x0c88: 0x5b000000
0x0c8c: 0x00000100
0x0d00: 0x01d0391b
0x0d20: 0x03a18ee2
0x0d30: 0x77777777
0x0d40: 0x24b38e0b
0x0d44: 0x58c0f019
0x0d4c: 0x000b4823
0x0d50: 0x77777777
0x0d54: 0x88888888
0x0d58: 0x88888888
0x0d5c: 0x88888888
0x0d64: 0x80000000
0x0d68: 0x003dffc0
0x0d6c: 0x064ca650
0x0d70: 0xe2527005
0x0d74: 0x000e453a
0x0d78: 0x00518154
0x0d80: 0x04000000
0x0d84: 0x03e00000
0x0d88: 0x5b000000
0x0d8c: 0xf40000c0
0x0e00: 0x01c03511
0x0e08: 0xf8000000
0x0e0c: 0xf8000000
0x0e20: 0x035186e0
0x0e30: 0x77777777
0x0e40: 0x24b38e0b
0x0e44: 0x58c0f019
0x0e4c: 0x000b4823
0x0e50: 0x76757677
0x0e54: 0x88888888
0x0e58: 0x88888888
0x0e5c: 0x88888888
0x0e64: 0x80000000
0x0e68: 0x003dffc0
0x0e6c: 0x064cae50
0x0e70: 0xe2526c0c
0x0e74: 0x000e453a
0x0e78: 0x00518154
0x0e80: 0x04000000
0x0e84: 0x03e00000
0x0e88: 0x5b000000
0x0e8c: 0x00000100
0x0f00: 0x02103f1d
0x0f08: 0xfc000000
0x0f0c: 0xfc000000
0x0f20: 0x03a186dd
0x0f30: 0x77777777
0x0f40: 0x24b38e0b
0x0f44: 0x58c0f019
0x0f4c: 0x000b4823
0x0f50: 0x77777777
0x0f54: 0x88888888
0x0f58: 0x88888888
0x0f5c: 0x88888888
0x0f64: 0x80000000
0x0f68: 0x003dffc0
0x0f6c: 0x064ca550
0x0f70: 0xe2526e0c
0x0f74: 0x000e453a
0x0f78: 0x00518154
0x0f80: 0x04000000
0x0f84: 0x03e00000
0x0f88: 0x5b000000
0x0f8c: 0x00000100
0x1200: 0x0469d387
0x1210: 0x0069d387
0x1218: 0x00102005
0x121c: 0x1013a017
0x1220: 0x00000001
0x1224: 0x02000000
0x1228: 0x016e0000
0x1300: 0x0469d387
0x1310: 0x0069d387
0x1318: 0x00102006
0x131c: 0x1013a017
0x1320: 0x00000001
0x1324: 0x02000000
0x1400: 0x0469d387
0x140c: 0x1001a017
0x1424: 0x02000000
0x1500: 0x0469d387
0x150c: 0x1001a017
0x1524: 0x02000000
0x1600: 0x24b38e0b
0x1604: 0x58c0f019
0x1608: 0x0469d387
0x160c: 0x0069d387
0x1610: 0x023d19c9
0x1614: 0x100f5fd8
0x1618: 0x1c0e98dc
0x161c: 0x1460e7d4
0x1620: 0x06000000
0x1624: 0x50518154
0x1628: 0x0080ca02
0x162c: 0x000b4823
0x1630: 0x235991cb
0x1634: 0x1a75a75e
0x1800: 0x00000001
0x1804: 0x023d19c9
0x180c: 0x08102009
0x1810: 0x00000017
0x1814: 0x02000000
0x1818: 0x00000001
0x1820: 0xf8010000
0x1900: 0x00000001
0x1904: 0x023d19c9
0x190c: 0x08102009
0x1910: 0x00000017
0x1914: 0x02000000
0x1918: 0x00000001
0x1920: 0x00010000
0x1a00: 0x0469d387
0x1a0c: 0x1001a017
0x1a24: 0x02000000
0x1b00: 0x0469d387
0x1b0c: 0x1001a017
0x1b24: 0x02000000
0x1c10: 0x0069d387
0x1c18: 0x08102005
0x1c1c: 0x10120017
0x1c20: 0x00000001
0x1c24: 0x02000000
0x1d10: 0x0069d387
0x1d18: 0x08102006
0x1d1c: 0x10120017
0x1d20: 0x00000001
0x1d24: 0x02000000
0x2008: 0x00500316
0x3000: 0x01c03511
0x3008: 0xf8000000
0x300c: 0xf8000000
0x3020: 0x035186e0
0x3030: 0x77777777
0x3040: 0x24b38e0b
0x3044: 0x58c0f019
0x304c: 0x000b4823
0x3050: 0x76757677
0x3054: 0x88888888
0x3058: 0x88888888
0x305c: 0x88888888
0x3064: 0x80000000
0x3068: 0x003dffc0
0x306c: 0x064cae50
0x3070: 0xe2526c0c
0x3074: 0x000e453a
0x3078: 0x00518154
0x3080: 0x04000000
0x3084: 0x03e00000
0x3088: 0x5b000000
0x308c: 0x00000100
0x3100: 0x01a032fb
0x3108: 0xf8000000
0x310c: 0xf8000000
0x3120: 0x038102a1
0x3130: 0x77777777
0x3140: 0x24b38e0b
0x3144: 0x58c0f019
0x314c: 0x000b4823
0x3150: 0x77777777
0x3154: 0x88888888
0x3158: 0x88888888
0x315c: 0x88888888
0x3164: 0x80000000
0x3168: 0x003dffc0
0x316c: 0x062c6650
0x3170: 0xe2525000
0x3174: 0x000e453a
0x3178: 0x00518154
0x3180: 0x04000000
0x3184: 0x03e00000
0x3188: 0x5b000000
0x318c: 0xf0000080
0x3200: 0x0469d387
0x320c: 0x1001a017
0x3224: 0x02000000
0x3300: 0x0469d387
0x330c: 0x1001a017
0x3324: 0x02000000
0x3410: 0x0069d387
0x3418: 0x08102005
0x341c: 0x10120017
0x3420: 0x00000001
0x3424: 0x02000000
0x3510: 0x0069d387
0x3518: 0x08102006
0x351c: 0x10120017
0x3520: 0x00000001
0x3524: 0x02000000
0x3600: 0x01c03511
0x3608: 0xf8000000
0x360c: 0xf8000000
0x3620: 0x035186e0
0x3630: 0x77777777
0x3640: 0x24b38e0b
0x3644: 0x58c0f019
0x364c: 0x000b4823
0x3650: 0x76757677
0x3654: 0x88888888
0x3658: 0x88888888
0x365c: 0x88888888
0x3664: 0x80000000
0x3668: 0x003dffc0
0x366c: 0x064cae50
0x3670: 0xe2526c0c
0x3674: 0x000e453a
0x3678: 0x00518154
0x3680: 0x04000000
0x3684: 0x03e00000
0x3688: 0x5b000000
0x368c: 0x00000100
0x3700: 0x0469d387
0x370c: 0x1001a017
0x3724: 0x02000000
0x3810: 0x0069d387
0x3818: 0x08102005
0x381c: 0x10120017
0x3820: 0x00000001
0x3824: 0x02000000
0x3900: 0x00000001
0x3904: 0x023d19c9
0x390c: 0x08102009
0x3910: 0x00000017
0x3914: 0x02000000
0x3918: 0x00000001
0x3920: 0xf8010000
0x3a00: 0x24b38e0b
0x3a04: 0x58c0f019
0x3a08: 0x0469d387
0x3a0c: 0x0069d387
0x3a10: 0x023d19c9
0x3a14: 0x100f5fd8
0x3a18: 0x1c0e98dc
0x3a1c: 0x1460e7d4
0x3a20: 0x06000000
0x3a24: 0x56518154
0x3a28: 0x0080ca02
0x3a2c: 0x000b4823
0x3a30: 0x235991cb
0x3a34: 0x1a75a75e
0x4000: 0x17061c0a
0x4004: 0x00024410
0x4008: 0x170f5054
0x400c: 0x07060404
0x4010: 0x0a090808
0x4014: 0x06061013
0x4018: 0x07070404
0x401c: 0x1c00443c
0x4020: 0x37373723
0x4024: 0x0e154444
0x402c: 0x00000004
0x4034: 0x00000c00
0x4038: 0x01000040
0x403c: 0x00600040
0x4040: 0x00006040
0x4044: 0x00000046
0x4054: 0x76543210
0x4068: 0x383f2838
0x406c: 0x00401010
0x4070: 0x190a0010
0x4078: 0x0000c600
0x4100: 0x0000c749
0x4138: 0x01010100
0x4190: 0x0000000f
0x4194: 0x0000000f
0x419c: 0x10070002
0x41a0: 0x61110111
0x41bc: 0x01010100
0x41c0: 0x00000010
0x4200: 0x003f0000
0x4210: 0x01200d00
0x4218: 0xc3c3c3c3
0x421c: 0xc3c3c3c3
0x4224: 0x03030303
0x4228: 0x02020200
0x4230: 0x20210210
0x4234: 0x64210210
0x4238: 0x56009840
0x423c: 0x00ea13be
0x4240: 0x62000255
0x4244: 0x00004000
0x4248: 0x00020080
0x424c: 0x000002c0
0x4254: 0x00000001
0x4260: 0x0000000b
0x4264: 0x00000007
0x4268: 0x0000008f
0x426c: 0x000000c8
0x4270: 0x00000096
0x4274: 0xffffffff
0x4278: 0x80000002
0x42a8: 0x76543210
0x42b0: 0xd09afd6a
0x4330: 0xffff0001
0x4358: 0x00000002
0x4360: 0x0000007f
0x4364: 0x0000007f
0x4368: 0x0000007f
0x436c: 0x0000007f
0x4370: 0x0000007f
0x4374: 0x0000007f
0x4378: 0x0000007f
0x437c: 0x0000007f
0x4380: 0x0000007f
0x43a0: 0x00030104
0x43a4: 0x000006c0
0x43a8: 0x00200008
0x43ac: 0x00000051
0x43b8: 0x4f4f4f52
0x43bc: 0x50515250
0x43cc: 0x6450047f
0x43fc: 0x00003800
0x4400: 0x17061c0a
0x4404: 0x00024410
0x4408: 0x170f5054
0x440c: 0x07060404
0x4410: 0x0a090808
0x4414: 0x06061013
0x4418: 0x07070404
0x441c: 0x1c00443c
0x4420: 0x37373722
0x4424: 0x0e154444
0x442c: 0x00000004
0x4434: 0x00000c00
0x4438: 0x01000040
0x443c: 0x00600040
0x4440: 0x00006040
0x4444: 0x00000046
0x4454: 0x76543210
0x4468: 0x383f2838
0x446c: 0x00401010
0x4470: 0x190a0010
0x4478: 0x0000c600
0x4500: 0x0000c749
0x4538: 0x01010100
0x4590: 0x0000000f
0x4594: 0x0000000f
0x459c: 0x10070002
0x45a0: 0x61110111
0x45bc: 0x01010100
0x45c0: 0x00000010
0x4600: 0x003f0000
0x4610: 0x01200d00
0x4618: 0xc3c3c3c3
0x461c: 0xc3c3c3c3
0x4624: 0x03030303
0x4628: 0x02020200
0x4630: 0x20210210
0x4634: 0x64210210
0x4638: 0x56009840
0x463c: 0x00ea13be
0x4640: 0x62000255
0x4644: 0x00004000
0x4648: 0x00020080
0x464c: 0x000002c0
0x4654: 0x00000001
0x4660: 0x0000000b
0x4664: 0x00000007
0x4668: 0x0000008f
0x466c: 0x000000c8
0x4670: 0x00000096
0x4674: 0xffffffff
0x4678: 0x80000002
0x46a8: 0x76543210
0x46b0: 0xe280ccf9
0x4730: 0xffff0001
0x4758: 0x00000002
0x4760: 0x0000007f
0x4764: 0x0000007f
0x4768: 0x0000007f
0x476c: 0x0000007f
0x4770: 0x0000007f
0x4774: 0x0000007f
0x4778: 0x0000007f
0x477c: 0x0000007f
0x4780: 0x0000007f
0x47a0: 0x00030104
0x47a4: 0x000006c0
0x47a8: 0x00200008
0x47ac: 0x00000056
0x47b8: 0x56555555
0x47bc: 0x00010054
0x47cc: 0x6450047f
0x47fc: 0x00003800
0x4804: 0x00030000
0x4808: 0x08000000
0x480c: 0x08000000
0x4810: 0x08000000
0x4814: 0x08000000
0x4818: 0x08000000
0x481c: 0x08000000
0x4820: 0x08000000
0x4824: 0x08000000
0x4830: 0x08000000
0x4834: 0x08000000
0x4838: 0x08000000
0x483c: 0x08000000
0x4840: 0x08000000
0x4844: 0x08000000
0x4848: 0x08000000
0x484c: 0x08000000
0x4858: 0x21110202
0x485c: 0x21110202
0x4860: 0x21110202
0x4864: 0x21110202
0x4868: 0x21110202
0x486c: 0x21110202
0x4870: 0x21110202
0x4874: 0x21110202
0x4880: 0x21110202
0x4884: 0x21110202
0x4888: 0x21110202
0x488c: 0x21110202
0x4890: 0x21110202
0x4894: 0x21110202
0x4898: 0x21110202
0x489c: 0x21110202
0x48a8: 0x00003000
0x48b0: 0x00003000
0x48e8: 0xff0007f8
0x48ec: 0x070700ff
0x48f0: 0xff0007f8
0x48f4: 0x070700ff
0x4908: 0xf00000e4
0x490c: 0xf00000e4
0x4910: 0x00000008
0x4918: 0x00000008
0x4938: 0x0a418820
0x493c: 0x0a418820
0x4940: 0x16a4a0e6
0x4944: 0x0041ee6b
0x4948: 0x16a4a0e6
0x494c: 0x0041ee6b
0x4958: 0x0000ff00
0x495c: 0x0000ff00
0x4960: 0x01010100
0x4964: 0x01010100
0x4980: 0x76543210
0x4984: 0xfedcba98
0x4988: 0x76543210
0x498c: 0xfedcba98
0x49a8: 0x01ffffff
0x49ac: 0x01ffffff
0x4c00: 0x17061c0a
0x4c04: 0x00024410
0x4c08: 0x170f5054
0x4c0c: 0x07060404
0x4c10: 0x0a090808
0x4c14: 0x06061013
0x4c18: 0x07070404
0x4c1c: 0x1c00443c
0x4c20: 0x37373723
0x4c24: 0x0e154444
0x4c2c: 0x00000004
0x4c34: 0x00000c00
0x4c38: 0x01000040
0x4c3c: 0x00600040
0x4c40: 0x00006040
0x4c44: 0x00000046
0x4c54: 0x76543210
0x4c68: 0x383f2838
0x4c6c: 0x00401010
0x4c70: 0x190a0010
0x4c78: 0x0000c600
0x4d00: 0x0000c749
0x4d38: 0x01010100
0x4d90: 0x0000000f
0x4d94: 0x0000000f
0x4d9c: 0x10070002
0x4da0: 0x61110111
0x4dbc: 0x01010100
0x4dc0: 0x00000010
0x4e00: 0x003f0000
0x4e10: 0x01200d00
0x4e18: 0xc3c3c3c3
0x4e1c: 0xc3c3c3c3
0x4e24: 0x03030303
0x4e28: 0x02020200
0x4e30: 0x20210210
0x4e34: 0x64210210
0x4e38: 0x56009840
0x4e3c: 0x00ea13be
0x4e40: 0x62000255
0x4e44: 0x00004000
0x4e48: 0x00020080
0x4e4c: 0x000002c0
0x4e54: 0x00000001
0x4e60: 0x0000000b
0x4e64: 0x00000007
0x4e68: 0x0000008f
0x4e6c: 0x000000c8
0x4e70: 0x00000096
0x4e74: 0xffffffff
0x4e78: 0x80000002
0x4ea8: 0x76543210
0x4eb0: 0xd09d0401
0x4f30: 0xffff0001
0x4f58: 0x00000002
0x4f60: 0x0000007f
0x4f64: 0x0000007f
0x4f68: 0x0000007f
0x4f6c: 0x0000007f
0x4f70: 0x0000007f
0x4f74: 0x0000007f
0x4f78: 0x0000007f
0x4f7c: 0x0000007f
0x4f80: 0x0000007f
0x4fa0: 0x00030104
0x4fa4: 0x000006c0
0x4fa8: 0x00200008
0x4fac: 0x00000051
0x4fb8: 0x4f4f4f52
0x4fbc: 0x50515250
0x4fcc: 0x6450047f
0x4ffc: 0x00003800
0x5000: 0x00008000
0x5004: 0x00000110
0x5008: 0x00000110
0x500c: 0x00000008
0x5010: 0x00000008
0x5018: 0x00000013
0x5024: 0x120c3200
0x5030: 0x004001ab
0x5034: 0x03000000
0x5040: 0x485b1c5d
0x5044: 0x839afa0b
0x5048: 0x4c43f557
0x5050: 0xa3bd5dbf
0x5054: 0x7a96079b
0x5058: 0x84577446
0x505c: 0x328aa589
0x5060: 0x00010200
0x5068: 0x23085088
0x5074: 0x00000010
0x5078: 0x00001844
0x5080: 0x000a4016
0x5084: 0x00010cff
0x5094: 0xffffffff
0x50a4: 0x76543210
0x50fc: 0x0000008f
0x5130: 0xa0b401c2
0x5134: 0x000f0b05
0x5138: 0x00002484
0x5400: 0xfed90001
0x5410: 0xfed91001
0x5418: 0x00000014
0x541c: 0x30000000
0x5420: 0xfed84001
0x5428: 0x00000055
0x5500: 0x00000001
0x5828: 0xc1ddb08b
0x582c: 0x00000005
0x5830: 0x717bd46d
0x5834: 0x00000004
0x5838: 0x1a1f574d
0x5840: 0x085bf23d
0x5848: 0x179fd4a0
0x5850: 0x179fd4a0
0x5858: 0x0724531b
0x5880: 0x00000160
0x5884: 0x00000005
0x588c: 0x00000101
0x5890: 0x0000ffff
0x5894: 0x0000ffff
0x5898: 0x0000ffff
0x589c: 0x0000ffff
0x58a4: 0x00000007
0x58bc: 0x0000007f
0x58d0: 0x0000ffff
0x58d4: 0x0000ffff
0x58d8: 0x0000ffff
0x58dc: 0x0000ffff
0x58e4: 0x005400de
0x58e8: 0x02bf68b4
0x58f8: 0x00218019
0x58fc: 0x15000000
0x5900: 0x01000000
0x5904: 0x01000000
0x590c: 0x00000002
0x5918: 0x1410040a
0x5920: 0x00000010
0x5924: 0x00000010
0x5928: 0x0328db1f
0x592c: 0x00039f0a
0x5930: 0x00000078
0x5938: 0x000a0e03
0x593c: 0x11e0c777
0x5940: 0x004ac4a1
0x5944: 0x00512340
0x5954: 0x001c0000
0x5958: 0xf9011400
0x595c: 0x0004043d
0x5960: 0x001aaee0
0x5968: 0x81a5ac4b
0x596c: 0xfef4f2a5
0x5974: 0x6cd209e8
0x5978: 0x00000030
0x597c: 0x00000030
0x5980: 0x0000002e
0x5984: 0x0c9f4762
0x5994: 0x000000ff
0x5998: 0x00060617
0x599c: 0x00640000
0x59a0: 0x00dd8078
0x59a4: 0x00428160
0x59b0: 0x00000238
0x59b8: 0x32004b32
0x59c0: 0x88360000
0x5d10: 0x00000001
0x5d20: 0x00000005
0x5d24: 0x000001f4
0x5d44: 0x76543210
0x5da8: 0x00000003
0x5e00: 0x00000009
0x5e04: 0x00000009
0x5f00: 0x00002706
0x5f04: 0x00000011
0x5f08: 0x00000014
0x5f14: 0x00000001
0x5f18: 0x00000001
0x5f3c: 0x00000012
0x5f40: 0x00080050
0x5f48: 0x001400c8
0x5f54: 0x00000011
0x6000: 0x00000004
0x6008: 0x800000f8
0x6010: 0xfff00000
0x6014: 0x0000007f
0x6020: 0x00000001
0x6030: 0x000700b0
0x6034: 0x000700b0
0x6044: 0x76543210
0x6100: 0x00fec000
0x6200: 0x88340800
0x6204: 0x00000003
0x6300: 0x00001888
0x6304: 0x00001888
0x63fc: 0x00000001
0x6410: 0x00000f00
0x6434: 0x76543210
0x6438: 0x004a0000
0x6800: 0x80000044
0x6804: 0x800000ff
0x7000: 0x80444444
0x701c: 0x01400000
0x702c: 0x00000002
0x7030: 0x00000080
0x7060: 0x000883e8
0x7070: 0x000083e8
0x7080: 0x000883e8
0x713c: 0x00000002
0x7178: 0x76543210
0x7180: 0x76543210
0x7184: 0x76543210
0x7190: 0x76543210
0x71a0: 0x76543210
0x71ac: 0x76543210
0x7200: 0x24924924
0x7204: 0x00924924
0x7208: 0x00924844
0x720c: 0x00924924
0x7210: 0x00004844
0x721c: 0x24924924
0x7220: 0x00004844
0x7224: 0x00000924
0x7228: 0x00004844
0x722c: 0x24924924
0x7230: 0x00004924
0x7234: 0x00024924
0x723c: 0x00024924
0x7240: 0x00000024
0x7400: 0x0a241251
0x7404: 0x0a241251
0x7408: 0x00441492
0x740c: 0x00000012
0x7410: 0x00000652
0x7414: 0x0033bb67
0x7418: 0x00341080
0x741c: 0x0033bb67
0x7424: 0x76543210
0x7454: 0x00641080
0x7458: 0x0418d608
0x745c: 0x00000212
0x7460: 0x00004100
0x746c: 0x0000048a
0x7470: 0x0a241251
0x7474: 0x0a241251
0x7500: 0x00070000
0x7504: 0x000700b0
0x7600: 0x00001888
0x7604: 0x00001888
0x7608: 0x00001888
0x77fc: 0x00000001
0x7800: 0x00444444
0x7804: 0x00004400
0x7808: 0x00004444
0x780c: 0x44444444
0x7810: 0x40004444
0x7814: 0x00000444
0x7818: 0x00000044
0x782c: 0x76543210
0x7838: 0x00004848
0x7840: 0x00001888
0x7844: 0x00001888
0x7848: 0x00001888
0x7850: 0x00001888
0x7854: 0x00042108
0x7bfc: 0x00000001
0x7db4: 0x76543210
0x7dc4: 0x76543210
0x7de0: 0x00000024
0x7de4: 0x00001888
0x7de8: 0x00000444
0x7e54: 0x76543210



============= EPBAR =============

EPBAR = 0xfed19000 (MEM)

0x0000: 0x04010002
0x0004: 0x00000001
0x0010: 0x00000001
0x0014: 0x80000001
0x001c: 0x00008001
0x0020: 0x81000002
0x0040: 0x00010005
0x0044: 0x00010501
0x0050: 0x01010001
0x0058: 0xfed18000
0x0060: 0x02000002
0x0070: 0x03000002
0x0080: 0x04000002
0x0090: 0x05000002



============= DMIBAR ============

DMIBAR = 0xfed18000 (MEM)

dmibase+0x0000: 0x04010002 (DMIVCECH)
dmibase+0x0004: 0x00000000 (DMIPVCCAP1)
dmibase+0x0008: 0x00000000 (DMIPVCCAP2)
dmibase+0x000c: 0x0000     (DMIPVCCTL)
dmibase+0x0010: 0x00000001 (DMIVC0RCAP)
dmibase+0x0014: 0x80000803 (DMIVC0RCTL)
dmibase+0x001a: 0x0000     (DMIVC0RSTS)
dmibase+0x001c: 0x00008001 (DMIVC1RCAP)
dmibase+0x0020: 0x01000100 (DMIVC1RCTL)
dmibase+0x0026: 0x0002     (DMIVC1RSTS)
dmibase+0x0034: 0x00008000 (DMIVCMRCAP)
dmibase+0x0038: 0x87000880 (DMIVCMRCTL)
dmibase+0x003e: 0x0000     (DMIVCMRSTS)
dmibase+0x0040: 0x08010005 (DMIRCLDECH)
dmibase+0x0044: 0x01010202 (DMIESD)
dmibase+0x0050: 0x00020001 (DMILE1D)
dmibase+0x0058: 0x00000000 (DMILE1A)
dmibase+0x005c: 0x00000000 (DMILUE1A)
dmibase+0x0060: 0x00010001 (DMILE2D)
dmibase+0x0068: 0xfed19000 (DMILE2A)
dmibase+0x0084: 0x00000000 (LCAP)
dmibase+0x0088: 0x0000     (LCTL)
dmibase+0x008a: 0x0000     (LSTS)
dmibase+0x0098: 0x0000     (LCTL2)
dmibase+0x009a: 0x0000     (LSTS2)
dmibase+0x01c4: 0x00000000 (DMIUESTS)
dmibase+0x01c8: 0x00000000 (DMIUEMSK)
dmibase+0x01cc: 0x00060010 (DMIUESEV)
dmibase+0x01d0: 0x00000000 (DMICESTS)
dmibase+0x01d4: 0x00002000 (DMICEMSK)


========= PCIEXBAR ========

PCIEXBAR: 0xe0000000
Error mapping physical memory 0xe0000000[0x10000000]
